{"$schema":"https://json-schema.org/draft/2020-12/schema","title":"ReplayReport","type":"object","required":["replay_state","replay_attempted","comparison_attempted","comparison_completed","comparison_matched","primary_reason","reason_codes","package_open_result","replay_profile_id","comparison_profile_id","comparison_profile_version","comparison_profile_identity","source_identity","package_identity","trace_identity","expected_identity","actual_identity","actual_output","normalized_event_count","mismatches","invariants","timestamp_regressions","source_mutation_count","package_mutation_count","raw_trace_mutation_count","llm_invocation_count","advisor_invocation_count","feedback_invocation_count","network_invocation_count","shell_invocation_count","subprocess_invocation_count","hardware_validation"],"properties":{"replay_state":{"enum":["not_evaluated","reference_only","replay_pass","replay_fail"]},"replay_attempted":{"type":"boolean"},"comparison_attempted":{"type":"boolean"},"comparison_completed":{"type":"boolean"},"comparison_matched":{"type":["boolean","null"]},"primary_reason":{"type":["string","null"]},"reason_codes":{"type":"array","items":{"type":"string"}},"package_open_result":{"type":"string"},"replay_profile_id":{"type":"string"},"comparison_profile_id":{"type":"string"},"comparison_profile_version":{"type":["string","null"]},"source_identity":{"type":["string","null"]},"package_identity":{"type":["string","null"]},"trace_identity":{"type":["string","null"]},"expected_identity":{"type":["string","null"]},"actual_identity":{"type":["string","null"]},"actual_output":{"type":"object","additionalProperties":{"type":["integer","null"]}},"normalized_event_count":{"type":["integer","null"],"minimum":0},"mismatches":{"type":"array","items":{"type":"object","required":["mismatch_class","field","event_index","expected_value","actual_value"],"properties":{"mismatch_class":{"type":"string"},"field":{"type":"string"},"event_index":{"type":["integer","null"]},"expected_value":{"type":["string","integer","boolean","null"]},"actual_value":{"type":["string","integer","boolean","null"]}},"additionalProperties":false}},"invariants":{"type":"array","items":{"type":"object","required":["invariant_id","passed","event_index","reason"],"properties":{"invariant_id":{"type":"string"},"passed":{"type":"boolean"},"event_index":{"type":["integer","null"]},"reason":{"type":["string","null"]}},"additionalProperties":false}},"source_mutation_count":{"type":"integer","minimum":0},"package_mutation_count":{"type":"integer","minimum":0},"raw_trace_mutation_count":{"type":"integer","minimum":0},"llm_invocation_count":{"const":0,"enum":[0]},"advisor_invocation_count":{"const":0,"enum":[0]},"feedback_invocation_count":{"const":0,"enum":[0]},"network_invocation_count":{"const":0,"enum":[0]},"shell_invocation_count":{"const":0,"enum":[0]},"subprocess_invocation_count":{"const":0,"enum":[0]},"hardware_validation":{"const":false,"enum":[false]},"timestamp_regressions":{"type":"array","items":{"type":"object","required":["source_record_index","physical_line","previous_timestamp","current_timestamp","cpu_id","reason"],"properties":{"source_record_index":{"type":"integer","minimum":0},"physical_line":{"type":"integer","minimum":5},"previous_timestamp":{"type":"integer","minimum":0},"current_timestamp":{"type":"integer","minimum":0},"cpu_id":{"type":["integer","null"]},"reason":{"const":"TIMESTAMP_REGRESSION","enum":["TIMESTAMP_REGRESSION"]}},"additionalProperties":false}},"comparison_profile_identity":{"type":["string","null"],"pattern":"^[0-9a-f]{64}$"}},"additionalProperties":false}
