{"actual_identity":null,"actual_output":{},"advisor_invocation_count":0,"comparison_attempted":false,"comparison_completed":false,"comparison_matched":null,"comparison_profile_id":"not_applicable","comparison_profile_identity":null,"comparison_profile_version":null,"expected_identity":null,"feedback_invocation_count":0,"hardware_validation":false,"invariants":[],"llm_invocation_count":0,"mismatches":[],"network_invocation_count":0,"normalized_event_count":null,"package_identity":null,"package_mutation_count":0,"package_open_result":"not_attempted","primary_reason":"SOURCE_ACQUISITION_BLOCKED","raw_trace_mutation_count":0,"reason_codes":["SOURCE_ACQUISITION_BLOCKED"],"replay_attempted":false,"replay_profile_id":"not_applicable","replay_state":"reference_only","shell_invocation_count":0,"source_identity":"9c87e0e239364dc3ce35463057722cb9382d883e8851f98dbd0cba31c6bc45fb","source_mutation_count":0,"subprocess_invocation_count":0,"timestamp_regressions":[],"trace_identity":null}
