{"actual_identity":null,"actual_output":{},"advisor_invocation_count":0,"comparison_attempted":false,"comparison_completed":false,"comparison_matched":null,"comparison_profile_id":"not_applicable","comparison_profile_identity":null,"comparison_profile_version":null,"expected_identity":null,"feedback_invocation_count":0,"hardware_validation":false,"invariants":[],"llm_invocation_count":0,"mismatches":[],"network_invocation_count":0,"normalized_event_count":null,"package_identity":null,"package_mutation_count":0,"package_open_result":"not_attempted","primary_reason":"SOURCE_EXTERNAL_REFERENCE_ONLY","raw_trace_mutation_count":0,"reason_codes":["SOURCE_EXTERNAL_REFERENCE_ONLY"],"replay_attempted":false,"replay_profile_id":"not_applicable","replay_state":"reference_only","shell_invocation_count":0,"source_identity":"043d845899b2fd3b78516ce3d17d5129315717d26f5e9ac545be83fd2d905b21","source_mutation_count":0,"subprocess_invocation_count":0,"timestamp_regressions":[],"trace_identity":null}
