{"actual_identity":"c79f418b5f373301ea091a0b4a34a47f95372638b3f294d7f7258fb19a2d796d","actual_output":{"first_timestamp":148958,"last_timestamp":166226,"normalized_event_count":2389},"advisor_invocation_count":0,"comparison_attempted":true,"comparison_completed":true,"comparison_matched":true,"comparison_profile_id":"p7.4-freertos-semantic-exact-v1","comparison_profile_identity":"61efa43907c452fafdf61f5d3e91a0928ceefdb68c4b49041094fbc389ad1bd2","comparison_profile_version":"v1","expected_identity":"38d2b227066de0f17bffde223bf03aeef4702f5c45c94030cccaa763d77e564d","feedback_invocation_count":0,"hardware_validation":false,"invariants":[],"llm_invocation_count":0,"mismatches":[],"network_invocation_count":0,"normalized_event_count":2389,"package_identity":"56fed592762f19719af928520c9454e52fb9ba5a7f05dfc897b48b70e55b3af5","package_mutation_count":0,"package_open_result":"opened","primary_reason":null,"raw_trace_mutation_count":0,"reason_codes":[],"replay_attempted":true,"replay_profile_id":"p7.4-freertos-v1","replay_state":"replay_pass","shell_invocation_count":0,"source_identity":"924efb7928adac4b8286c1218609440004c27cece04a108408839c5700723bee","source_mutation_count":0,"subprocess_invocation_count":0,"timestamp_regressions":[],"trace_identity":"571183cbafba85f0eeb9c74cf2350f02a4e628abe514409dd3c1b68286969f44"}
